{
  "version": 1, "key": "d2eb3e81de29bfa6", "lang": "en",
  "tldr": "A check's description now has a limit of 10,000 characters. The API, the dashboard form and the edit dialog all enforce it, and the dashboard returns 400 on invalid input.",
  "intent": "Keep check descriptions to a bounded size on every path that writes them.",
  "story": [
    {"heading": "API now limits desc to 10,000 characters", "body": "The Spec model of the management API rejects a longer desc on create and update.", "stage": "architecture", "focus": ["api", "checks"], "code": "hc/api/views.py:63"},
    {"heading": "Dashboard form applies the same limit", "body": "NameTagsForm gets max_length=10000 on desc. The edit dialog textarea stops at 10,000 characters.", "stage": "flow:update-desc", "focus": ["#1"], "code": "hc/front/forms.py:36"},
    {"heading": "update_name now returns 400 on invalid input", "body": "Before, an invalid form skipped the save and redirected as if it worked. Now the view stops with 400.", "stage": "flow:update-desc", "focus": ["#1", "#2"], "code": "hc/front/views.py:559-569"},
    {"heading": "No change to the Check model", "body": "Check.desc keeps its type. The limit lives at the 2 entry points, so the change needs no migration.", "stage": "architecture", "focus": ["dashboard", "api", "checks"]}
  ],
  "hero": [],
  "changes": [
    {"id": "api", "summary": "The Spec model limits desc to 10,000 characters on create and update."},
    {"id": "dashboard", "summary": "NameTagsForm limits desc to 10,000 characters; update_name returns 400 when the form is invalid."},
    {"id": "ui", "summary": "The description textarea has maxlength=10000; the API docs list the new limit."}
  ],
  "decisions": [
    {"title": "Validate at the entry points, not in the model", "why": "The API Spec and the dashboard form each check the limit. Check.desc stays as it is, so no migration runs on a large table.", "alternative": "A max_length on Check.desc with a migration.", "evidence": "hc/api/views.py:63"},
    {"title": "Answer invalid dashboard input with 400", "why": "update_name used to skip a failed form without a sign. A 400 makes the failure visible to the caller.", "alternative": "Show the form error inside the dialog.", "evidence": "hc/front/views.py:562"}
  ],
  "flows": [
    {"id": "update-desc", "title": "Edit a check's description", "steps": [
      {"from": "dashboard", "to": "dashboard", "msg": "NameTagsForm.is_valid()", "status": "changed", "data": {"type": "NameTagsForm", "fields": ["~desc: max 10000 chars"]}},
      {"from": "dashboard", "to": "checks", "msg": "check.save(desc)", "status": "same"}]}
  ]
}
